{
  "$id": "urn:openaix:schema:path-point:0.1.0-draft.1",
  "$schema": "https://json-schema.org/draft/2020-12/schema",
  "additionalProperties": false,
  "description": "A path point is the geometry of the final approach segment of an approach that uses satellite navigation. It has the landing threshold point (LTP), the flight path alignment point (FPAP), the glide path angle and the threshold crossing height (TCH).",
  "properties": {
    "$schema": {
      "description": "This field identifies the schema that validates this document.",
      "minLength": 1,
      "type": "string"
    },
    "airfield": {
      "$ref": "urn:openaix:schema:common:0.1.0-draft.1#/$defs/Identifier",
      "description": "This field identifies the airfield of this record. An example is `kden`.",
      "x-catalog": "places"
    },
    "approach": {
      "description": "This field identifies the approach procedure. An example is `R16RY`.",
      "minLength": 1,
      "type": "string"
    },
    "approach_type": {
      "description": "This field gives the published type of the approach, for example `LPV` or `LP`.",
      "minLength": 1,
      "type": "string"
    },
    "course_width_at_threshold": {
      "$ref": "urn:openaix:schema:common:0.1.0-draft.1#/$defs/Length",
      "description": "This field gives the course width at the landing threshold point (LTP), as a length with its unit. It is the lateral distance from the course centreline at which full-scale deflection occurs."
    },
    "extensions": {
      "$ref": "urn:openaix:schema:common:0.1.0-draft.1#/$defs/Extensions",
      "allOf": [
        {
          "properties": {
            "sim": {
              "properties": {
                "dcs": {
                  "properties": {
                    "bindings": {
                      "items": {
                        "properties": {
                          "kind": {
                            "enum": [
                              "drawing",
                              "trigger_zone"
                            ]
                          }
                        }
                      }
                    }
                  },
                  "propertyNames": {
                    "enum": [
                      "bindings"
                    ]
                  }
                }
              }
            }
          }
        }
      ],
      "description": "This field contains extension data in groups. The namespace of each group identifies the application or standard that supplies its data. The group `sim` contains the simulator data of the record."
    },
    "final_approach_course": {
      "$ref": "urn:openaix:schema:common:0.1.0-draft.1#/$defs/Bearing",
      "description": "This field gives the final approach course, as a bearing with its unit and reference."
    },
    "flight_path_alignment_point": {
      "$ref": "urn:openaix:schema:common:0.1.0-draft.1#/$defs/GeoPoint",
      "description": "This field gives the geographic position of the flight path alignment point (FPAP), as latitude and longitude. With the landing threshold point (LTP), this point gives the direction of the final approach course."
    },
    "glide_path_angle_deg": {
      "description": "This field gives the angle between the glide path and a horizontal line, in degrees.",
      "exclusiveMaximum": 90,
      "exclusiveMinimum": 0,
      "type": "number"
    },
    "id": {
      "$ref": "urn:openaix:schema:common:0.1.0-draft.1#/$defs/Identifier",
      "description": "This field identifies this path point. Other resources and orders use this stable identifier to refer to this path point."
    },
    "kind": {
      "const": "path-point",
      "description": "The value identifies this record as a path point record. The value selects this navigation contract."
    },
    "landing_threshold_elevation": {
      "$ref": "urn:openaix:schema:common:0.1.0-draft.1#/$defs/Elevation",
      "description": "This field gives the orthometric height of the landing threshold point (LTP) above mean sea level, as an elevation with its unit."
    },
    "landing_threshold_point": {
      "$ref": "urn:openaix:schema:common:0.1.0-draft.1#/$defs/GeoPoint",
      "description": "This field gives the geographic position of the landing threshold point (LTP), as latitude and longitude. The path of the final approach goes above this point at the threshold crossing height."
    },
    "name": {
      "description": "This field gives the name of this path point, for display.",
      "minLength": 1,
      "type": "string"
    },
    "provenance": {
      "$ref": "urn:openaix:schema:procedure:0.1.0-draft.1#/$defs/Provenance",
      "description": "This field gives the provenance of this path point as structured data: how the data were made, the authority, the aeronautical information regulation and control (AIRAC) cycle and the tool that made them."
    },
    "resources_ref": {
      "$ref": "urn:openaix:schema:common:0.1.0-draft.1#/$defs/ResourceRef",
      "description": "This field identifies the resource catalogue that resolves the references of this path point. The reference gives the identifier and the revision of the catalogue."
    },
    "runway": {
      "$ref": "urn:openaix:schema:common:0.1.0-draft.1#/$defs/RunwayDesignator",
      "description": "This field gives the designator of the runway of the approach."
    },
    "source": {
      "description": "This field gives the source of this record. The value gives the authority that publishes the data, and the cycle, for example `FAA CIFP cycle 2610`. A record that an author writes does not have this field. The field `provenance` gives the same facts as structured data.",
      "minLength": 1,
      "type": "string"
    },
    "threshold_crossing_height": {
      "$ref": "urn:openaix:schema:common:0.1.0-draft.1#/$defs/Length",
      "description": "This field gives the threshold crossing height (TCH) of the path of the final approach, as a length with its unit. It is the height of the path of the final approach above the landing threshold point (LTP)."
    }
  },
  "required": [
    "id",
    "kind",
    "name",
    "landing_threshold_point",
    "flight_path_alignment_point",
    "glide_path_angle_deg",
    "threshold_crossing_height"
  ],
  "title": "Path point",
  "type": "object",
  "x-navigation-profile": "path-point"
}
