{
  "$schema": "urn:openaix:schema:path-point:0.1.0-draft.1",
  "airfield": "ojms",
  "approach": "R31",
  "approach_type": "LPV",
  "course_width_at_threshold": {
    "unit": "m",
    "value": 105
  },
  "extensions": {
    "sim": {
      "dcs": {
        "bindings": [
          {
            "angle_deg": 0,
            "kind": "drawing",
            "layer": "Blue",
            "mission_id": "oir-syria",
            "name": "OIR RW31 threshold",
            "object_id": 44,
            "primitive_type": "TextBox",
            "style": {
              "color": "0x3366FFFF",
              "fill_color": "0x3366FF20",
              "font_size": 14,
              "thickness": 2,
              "visible": true
            },
            "text": "RW31 LTP"
          }
        ]
      }
    }
  },
  "final_approach_course": {
    "declination_deg": 5.0,
    "reference": "magnetic",
    "value": 306.1
  },
  "flight_path_alignment_point": {
    "latitude": 31.84288,
    "longitude": 36.770832
  },
  "glide_path_angle_deg": 3.0,
  "id": "ojms-r31-path-point",
  "kind": "path-point",
  "landing_threshold_elevation": {
    "reference": "MSL",
    "unit": "m",
    "value": 498.7
  },
  "landing_threshold_point": {
    "latitude": 31.825413,
    "longitude": 36.79439
  },
  "name": "Muwaffaq Salti RNAV runway 31 final approach path",
  "provenance": {
    "airac_cycle": "2610",
    "authority": "Eagle Dynamics",
    "derivation": "derived",
    "effective_from": "2026-10-01T00:00:00Z",
    "effective_until": "2026-10-29T00:00:00Z",
    "generated_at": "2026-09-28T10:00:00Z",
    "publication": {
      "id": "ojms-i31-chart",
      "revision": "2610",
      "section": "DTA05",
      "title": "Muwaffaq Salti ILS runway 31 chart"
    },
    "tool": {
      "name": "DCS map file reader",
      "version": "2.9.8"
    }
  },
  "resources_ref": {
    "id": "oir-resources",
    "revision": "1"
  },
  "runway": "31",
  "source": "DCS World Syria map: AirfieldsTaxiways layer, radio.lua and beacons.lua",
  "threshold_crossing_height": {
    "unit": "ft",
    "value": 50
  }
}
